{
  "schema_version": 1,
  "pack_id": "windows-it-reference",
  "version": 7,
  "title": "Curated Windows IT diagnostic reference relationships",
  "reviewed_at": "2026-09-26",
  "disclaimer": "Reference relationships suggest mechanisms to test. They are not observations of a machine, proof of cause, repair instructions, or authority to act.",
  "sources": [
    {"source_id":"ks_ms_wer","title":"Windows Error Reporting","publisher":"Microsoft","url":"https://learn.microsoft.com/en-us/windows/win32/wer/windows-error-reporting","usage_note":"Primary product documentation used to summarize WER mechanisms; text is not copied."},
    {"source_id":"ks_ms_scm","title":"Service Control Manager","publisher":"Microsoft","url":"https://learn.microsoft.com/en-us/windows/win32/services/service-control-manager","usage_note":"Primary product documentation used to summarize service lifecycle and dependency behavior."},
    {"source_id":"ks_ms_process","title":"Processes and Threads","publisher":"Microsoft","url":"https://learn.microsoft.com/en-us/windows/win32/procthread/processes-and-threads","usage_note":"Primary Win32 documentation used to summarize process resource and identity mechanisms."},
    {"source_id":"ks_ms_cpu_analysis","title":"CPU Analysis","publisher":"Microsoft","url":"https://learn.microsoft.com/en-us/windows-hardware/test/wpt/cpu-analysis","usage_note":"Primary Windows Performance Toolkit guidance for critical-path, thread-ready, and CPU-interference analysis; it does not measure this product's PDF workload."},
    {"source_id":"ks_ms_device_codes","title":"Device Manager Problem Codes","publisher":"Microsoft","url":"https://learn.microsoft.com/en-us/windows-hardware/drivers/debugger/device-manager-problem-codes","usage_note":"Primary driver documentation used to interpret explicit device problem states."},
    {"source_id":"ks_ms_driver_install","title":"Troubleshooting Device and Driver Installations","publisher":"Microsoft","url":"https://learn.microsoft.com/en-us/windows-hardware/drivers/install/troubleshooting-device-and-driver-installations","usage_note":"Primary driver documentation used to relate SetupAPI and device state observations."},
    {"source_id":"ks_ms_disk","title":"Troubleshoot Disk Management","publisher":"Microsoft","url":"https://learn.microsoft.com/en-us/troubleshoot/windows-server/backup-and-storage/troubleshoot-disk-management","usage_note":"Primary support documentation used for disk and volume state distinctions."},
    {"source_id":"ks_ms_ntfs","title":"NTFS overview","publisher":"Microsoft","url":"https://learn.microsoft.com/en-us/windows-server/storage/file-server/ntfs-overview","usage_note":"Primary file-system documentation used for NTFS behavior and limitations."},
    {"source_id":"ks_ms_refs","title":"Guidance for troubleshooting ReFS volumes","publisher":"Microsoft","url":"https://learn.microsoft.com/en-us/troubleshoot/windows-server/backup-and-storage/troubleshoot-refs-volumes","usage_note":"Primary support documentation used for ReFS signals and distinguishing evidence."},
    {"source_id":"ks_ms_dns","title":"Troubleshooting DNS clients","publisher":"Microsoft","url":"https://learn.microsoft.com/windows-server/networking/dns/troubleshoot/troubleshoot-dns-client","usage_note":"Primary DNS troubleshooting documentation used for resolver distinctions."},
    {"source_id":"ks_ms_firewall","title":"Filter Origin Audit Log","publisher":"Microsoft","url":"https://learn.microsoft.com/en-us/windows/security/operating-system-security/network-security/windows-firewall/filter-origin-documentation","usage_note":"Primary firewall documentation used for explicit packet-drop attribution."},
    {"source_id":"ks_ms_winhttp","title":"WinHTTP AutoProxy Support","publisher":"Microsoft","url":"https://learn.microsoft.com/en-us/windows/win32/winhttp/winhttp-autoproxy-support","usage_note":"Primary WinHTTP documentation used for proxy discovery and application-scope distinctions."},
    {"source_id":"ks_ms_wifi_client","title":"Wireless network connectivity issues troubleshooting","publisher":"Microsoft","url":"https://learn.microsoft.com/en-us/troubleshoot/windows-client/networking/wireless-network-connectivity-issues-troubleshooting","usage_note":"Primary client guidance for association, authentication, address assignment, and external access distinctions."},
    {"source_id":"ks_ms_wifi_layout","title":"Wi-Fi and your home layout","publisher":"Microsoft","url":"https://support.microsoft.com/en-us/windows/experience/connectivity-networking/wi-fi-and-your-home-layout","usage_note":"Reviewed 2026-09-23: signal strength, interference, and coverage sections support a conditional weak-link hypothesis; a current signal percentage alone does not identify a disconnect cause."},
    {"source_id":"ks_ms_network_tss","title":"Collect data to analyze and troubleshoot Windows networking scenarios","publisher":"Microsoft","url":"https://learn.microsoft.com/en-us/troubleshoot/windows-client/windows-tss/collect-data-analyze-troubleshoot-windows-networking-scenarios","usage_note":"Primary client support guidance distinguishing DHCP client and server traces; no TSS execution is implied."},
    {"source_id":"ks_adobe_view_prefs","title":"Viewing PDFs and viewing preferences","publisher":"Adobe","url":"https://helpx.adobe.com/acrobat/using/viewing-pdfs-viewing-preferences.html","usage_note":"Primary Acrobat documentation for page cache, image display, and 2D acceleration preferences; applies only to affected Acrobat versions and workloads."},
    {"source_id":"ks_adobe_accessibility","title":"Reading PDFs with reflow and accessibility features","publisher":"Adobe","url":"https://helpx.adobe.com/acrobat/using/reading-pdfs-reflow-accessibility-features.html","usage_note":"Primary Acrobat documentation for reading-order analysis and accessibility buffer scope; does not imply a screen reader is active."},
    {"source_id":"ks_ms_schannel","title":"Manually Validating Schannel Credentials","publisher":"Microsoft","url":"https://learn.microsoft.com/en-us/windows/win32/secauthn/manually-validating-schannel-credentials","usage_note":"Primary Schannel documentation used for certificate validation mechanisms."},
    {"source_id":"ks_ms_power","title":"Modern Standby resume performance","publisher":"Microsoft","url":"https://learn.microsoft.com/en-us/windows-hardware/design/device-experiences/modern-standby-resume-performance","usage_note":"Primary power documentation used for resume and device-latency distinctions."},
    {"source_id":"ks_ms_whea","title":"Windows Hardware Error Architecture","publisher":"Microsoft","url":"https://learn.microsoft.com/en-us/windows-hardware/drivers/whea/windows-hardware-error-architecture","usage_note":"Primary WHEA documentation used for hardware error provenance."},
    {"source_id":"ks_ms_defender","title":"Microsoft Defender Antivirus event IDs and error codes","publisher":"Microsoft","url":"https://learn.microsoft.com/en-us/defender-endpoint/troubleshoot-microsoft-defender-antivirus","usage_note":"Primary security product documentation used for explicit Defender health signals."},
    {"source_id":"ks_ms_update","title":"Windows Update troubleshooting guidance","publisher":"Microsoft","url":"https://learn.microsoft.com/en-us/troubleshoot/windows-client/installing-updates-features-roles/troubleshoot-windows-update-issues","usage_note":"Primary support documentation used for servicing distinctions."},
    {"source_id":"ks_ms_dll","title":"Dynamic-link library search order","publisher":"Microsoft","url":"https://learn.microsoft.com/en-us/windows/win32/dlls/dynamic-link-library-search-order","usage_note":"Primary Win32 documentation used for runtime dependency mechanisms."},
    {"source_id":"ks_nv_cuda","title":"CUDA Compatibility","publisher":"NVIDIA","url":"https://docs.nvidia.com/deploy/cuda-compatibility/latest/","usage_note":"Primary NVIDIA documentation used for driver, toolkit, and feature compatibility distinctions."},
    {"source_id":"ks_ms_gpu_taskmgr","title":"GPUs in the Task Manager","publisher":"Microsoft","url":"https://devblogs.microsoft.com/directx/gpus-in-the-task-manager/","usage_note":"Primary DirectX team explanation of GPU engine and memory counters; aggregate utilization does not identify a game's bottleneck."},
    {"source_id":"ks_ms_display_refresh","title":"Change the refresh rate on your monitor in Windows","publisher":"Microsoft","url":"https://support.microsoft.com/en-us/windows/hardware/display-graphics/change-the-refresh-rate-on-your-monitor-in-windows","usage_note":"Primary Windows guidance on active display refresh and dynamic refresh-rate behavior."},
    {"source_id":"ks_ms_dxgi_vrr","title":"Variable refresh rate displays","publisher":"Microsoft","url":"https://learn.microsoft.com/en-us/windows/win32/direct3ddxgi/variable-refresh-rate-displays","usage_note":"Primary DirectX documentation distinguishing presentation synchronization from an application's own frame production."},
    {"source_id":"ks_nv_gpu_preference","title":"Setting the Preferred Graphics Processor","publisher":"NVIDIA","url":"https://www.nvidia.com/content/Control-Panel-Help/vLatest/en-us/mergedProjects/nv3d/Setting_the_Preferred_Graphics_Processor.htm","usage_note":"Primary NVIDIA guidance explaining Windows per-app GPU preference precedence on modern Windows."},
    {"source_id":"ks_nv_3d_settings","title":"Manage 3D Settings (reference)","publisher":"NVIDIA","url":"https://www.nvidia.com/content/Control-Panel-Help/vLatest/en-us/mergedProjects/nv3d/Manage_3D_Settings_%28reference%29.htm","usage_note":"Primary NVIDIA control-panel reference for per-app frame limits and presentation settings."},